[
  {
    "claim_id": "CLM-B4-A",
    "claim_text": "The five-layer Position Object appears sufficient for MVP implementation.",
    "assertion_type": "SYNTHETIC_INFERENCE",
    "created_at": null,
    "source_claim_id": null
  },
  {
    "claim_id": "CLM-B4-B",
    "claim_text": "The five-responsibility Decision Object core survives, but implementation semantics require continuity-type specialization.",
    "assertion_type": "SYNTHETIC_INFERENCE",
    "created_at": null,
    "source_claim_id": "CLM-B4-A"
  }
]